{
  "ticket_id": "CLIP-001",
  "status": "BLOCKED",
  "branch": "agent/CLIP-001",
  "worktree": "/srv/clipos/worktrees/CLIP-001",
  "summary": "Implemented the complete M0 skeleton: typed API health/provider/module/audit contracts and tests, minimal typed web skeleton, deterministic development Compose topology, Make commands, developer documentation, and the CI test lane. All host-executable validation passed. Python test/lint, TypeScript typecheck, and Git commit are blocked by the sandbox execution environment.",
  "files_changed": [
    ".agent/plans/CLIP-001.md",
    ".agent/task_packet_CLIP-001.md",
    ".github/workflows/baseline-ci.yml",
    ".gitignore",
    "Makefile",
    "apps/web/app/layout.tsx",
    "apps/web/app/page.tsx",
    "apps/web/next.config.js",
    "apps/web/package.json",
    "apps/web/tsconfig.json",
    "docker-compose.dev.yml",
    "docs/development.md",
    "services/api/clipos_api/__init__.py",
    "services/api/clipos_api/audit.py",
    "services/api/clipos_api/main.py",
    "services/api/clipos_api/modules.py",
    "services/api/clipos_api/providers.py",
    "services/api/clipos_api/registry.py",
    "services/api/pyproject.toml",
    "services/api/tests/test_audit.py",
    "services/api/tests/test_health.py",
    "services/api/tests/test_modules.py",
    "services/api/tests/test_registry.py"
  ],
  "migrations": [],
  "contracts_changed": [
    "GET /health",
    "logical provider alias registry",
    "11 provider interfaces",
    "21 bounded-module enum",
    "structured audit event format"
  ],
  "tests": [
    {
      "name": "Python unit tests",
      "command": "python3 -m pytest -q services/api",
      "result": "SKIP",
      "evidence": "pytest and all API runtime dependencies are absent locally; pip install cannot resolve pypi.org because DNS/network access is unavailable. Exit 1: /usr/bin/python3: No module named pytest."
    },
    {
      "name": "API lint",
      "command": "ruff check services/api",
      "result": "SKIP",
      "evidence": "ruff is not installed and cannot be installed through the blocked network. Source compilation was run instead and passed."
    },
    {
      "name": "Web typecheck",
      "command": "npx tsc --noEmit",
      "result": "SKIP",
      "evidence": "No Node.js/npm/npx runtime exists on the host. A host TypeScript binary exists but cannot execute without Node; package installation is blocked by DNS/network access."
    },
    {
      "name": "Development Compose validation",
      "command": "docker compose -f docker-compose.dev.yml config -q",
      "result": "PASS",
      "evidence": "Exit 0."
    },
    {
      "name": "Repository handoff validation",
      "command": "python3 scripts/validate_handoff.py",
      "result": "PASS",
      "evidence": "OK: 108 tickets; current=CLIP-001; spec=2.0-hermes-vps"
    },
    {
      "name": "Secret scan",
      "command": "bash scripts/secret_scan.sh",
      "result": "PASS",
      "evidence": "secret_scan: clean"
    },
    {
      "name": "Workflow and compose YAML parse",
      "command": "python3 yaml.safe_load(.github/workflows/baseline-ci.yml, docker-compose.dev.yml)",
      "result": "PASS",
      "evidence": "Both files parsed successfully."
    },
    {
      "name": "Python source syntax compilation",
      "command": "python3 -m compileall -q services/api",
      "result": "PASS",
      "evidence": "Exit 0 with no syntax errors."
    }
  ],
  "security_rights_budget_impact": "No secrets, external side effects, rights actions, publishing paths, or spend are introduced. Development credentials are explicitly marked local-only. Provider identity remains registry-resolved and the no-hardcoded-identifier test is present. Audit output is structured JSON lines in an ignored .agent/audit directory.",
  "known_limitations": [
    "Automated Python and TypeScript quality gates must execute in CI or an environment with package and Node runtime access.",
    "Docker Compose configuration is valid, but container startup was not attempted because the current user cannot access the Docker socket.",
    "Git commit is unavailable because the shared Git directory is read-only from this worktree.",
    "The package intentionally contains no product feature code or database migrations."
  ],
  "commit_shas": [],
  "working_tree_clean": false,
  "blockers": [
    "Package installs required for pytest, ruff, FastAPI, Pydantic, SQLAlchemy, and HTTPX fail because DNS/network access is unavailable; pip reports 'Name or service not known' for pypi.org.",
    "Node.js/npm/npx are absent, so npx tsc --noEmit cannot run locally.",
    "Git index creation fails with 'Read-only file system' at /srv/clipos/clipOS/.git/worktrees/CLIP-001/index.lock; the tree state is preserved in .agent/dryrun/CLIP-001_tree_state.txt for orchestrator landing."
  ]
}
